{
  "@type": "https://schema.metadatacenter.org/core/StaticTemplateField",
  "@context": {
    "xsd": "http://www.w3.org/2001/XMLSchema#",
    "pav": "http://purl.org/pav/",
    "bibo": "http://purl.org/ontology/bibo/",
    "oslc": "http://open-services.net/ns/core#",
    "schema": "http://schema.org/",
    "skos": "http://www.w3.org/2004/02/skos/core#",
    "schema:name": {
      "@type": "xsd:string"
    },
    "schema:description": {
      "@type": "xsd:string"
    },
    "skos:prefLabel": {
      "@type": "xsd:string"
    },
    "skos:altLabel": {
      "@type": "xsd:string"
    },
    "pav:createdOn": {
      "@type": "xsd:dateTime"
    },
    "pav:createdBy": {
      "@type": "@id"
    },
    "pav:lastUpdatedOn": {
      "@type": "xsd:dateTime"
    },
    "oslc:modifiedBy": {
      "@type": "@id"
    }
  },
  "type": "object",
  "title": "What is a template? field schema",
  "description": "What is a template? field schema generated by the CEDAR Template Editor 2.1.11",
  "_ui": {
    "inputType": "richtext",
    "_content": "<p>Lorem ipsum</p>\n"
  },
  "pav:createdOn": "2018-11-12T13:31:51-0800",
  "pav:createdBy": "https://metadatacenter.org/users/018bbf94-f8e4-4e0e-946d-341698f70245",
  "pav:lastUpdatedOn": "2018-11-12T13:31:51-0800",
  "oslc:modifiedBy": "https://metadatacenter.org/users/018bbf94-f8e4-4e0e-946d-341698f70245",
  "schema:schemaVersion": "1.6.0",
  "schema:description": "Help Text",
  "additionalProperties": false,
  "schema:name": "What is a template?",
  "@id": "https://repo.staging.metadatacenter.org/template-fields/8be2ca75-f253-4e1c-9d46-e9126c7c694e",
  "$schema": "http://json-schema.org/draft-04/schema#"
}