{
  "@type": "https://schema.metadatacenter.org/core/StaticTemplateField",
  "@context": {
    "schema": "http://schema.org/",
    "pav": "http://purl.org/pav/",
    "bibo": "http://purl.org/ontology/bibo/",
    "oslc": "http://open-services.net/ns/core#"
  },
  "type": "object",
  "title": "Cell image field schema",
  "description": "Cell image field schema generated by the CEDAR Template Editor 2.1.11",
  "_ui": {
    "inputType": "image",
    "_content": "https://example.org/cell-image.jpg"
  },
  "pav:createdOn": "2018-11-12T13:31:51-0800",
  "pav:createdBy": "https://metadatacenter.org/users/018bbf94-f8e4-4e0e-946d-341698f70245",
  "pav:lastUpdatedOn": "2018-11-12T13:31:51-0800",
  "oslc:modifiedBy": "https://metadatacenter.org/users/018bbf94-f8e4-4e0e-946d-341698f70245",
  "schema:schemaVersion": "1.6.0",
  "schema:description": "Help Text",
  "additionalProperties": false,
  "schema:name": "Cell image",
  "@id": "https://repo.staging.metadatacenter.org/template-fields/5b2d1d05-ff24-4a8e-9c8f-f7f976775cdb",
  "$schema": "http://json-schema.org/draft-04/schema#"
}