{
  "@type": "https://schema.metadatacenter.org/core/StaticTemplateField",
  "@context": {
    "schema": "http://schema.org/",
    "pav": "http://purl.org/pav/",
    "bibo": "http://purl.org/ontology/bibo/",
    "oslc": "http://open-services.net/ns/core#"
  },
  "type": "object",
  "title": "This is a page break field schema",
  "description": "This is a page break field schema generated by the CEDAR Template Editor 2.1.11",
  "_ui": {
    "inputType": "page-break",
    "_content": null
  },
  "pav:createdOn": "2018-11-12T13:31:51-0800",
  "pav:createdBy": "https://metadatacenter.org/users/018bbf94-f8e4-4e0e-946d-341698f70245",
  "pav:lastUpdatedOn": "2018-11-12T13:31:51-0800",
  "oslc:modifiedBy": "https://metadatacenter.org/users/018bbf94-f8e4-4e0e-946d-341698f70245",
  "schema:schemaVersion": "1.6.0",
  "schema:description": "Help Text",
  "additionalProperties": false,
  "schema:name": "This is a page break",
  "@id": "https://repo.staging.metadatacenter.org/template-fields/ae0fb67e-2f3a-437c-a3b6-b7a61d8ce8a6",
  "$schema": "http://json-schema.org/draft-04/schema#"
}